symbol,synonym_symbol,scientific_name,common_name,fips_code
JUGR7,NA,Juniperus grandis R.P. Adams,western juniper,US32
JUGR7,JUOCA2,Juniperus occidentalis Hook. ssp. australis V,NA,US32
JUHE,NA,Juncus hemiendytus F.J. Herm.,Herman's dwarf rush,US32
JUHEA,JUAB2,Juncus abjectus F.J. Herm.,NA,US32
JUHEA,NA,Juncus hemiendytus F.J. Herm. var. abjectus (,Herman's dwarf rush,US32
JUHEH,NA,Juncus hemiendytus F.J. Herm. var. hemiendytu,Herman's dwarf rush,US32
JUKE,NA,Juncus kelloggii Engelm.,Kellogg's dwarf rush,US32
JUKE,JUBR7,Juncus brachystylus (Engelm.) Piper,NA,US32
JULO,NA,Juncus longistylis Torr.,longstyle rush,US32
JULOL,NA,Juncus longistylis Torr. var. longistylis,longstyle rush,US32
JUMA3,NA,Juncus macrophyllus Coville,longleaf rush,US32
JUME3,JUSL,Juncus slwookoorum S.B. Young,NA,US32
JUME3,NA,Juncus mertensianus Bong.,Mertens' rush,US32
JUME4,JUBAM3,Juncus balticus Willd. var. mexicanus (Willd.,NA,US32
JUME4,NA,Juncus mexicanus Willd. ex Schult. & Schult. ,Mexican rush,US32
JUNCU,NA,Juncus L.,rush,US32
JUNE,NA,Juncus nevadensis S. Watson,Sierra rush,US32
JUNEB,JUMEB,Juncus mertensianus Bong. var. badius (Suksd.,NA,US32
JUNEB,JUBA2,Juncus badius Suksd.,NA,US32
JUNEB,NA,Juncus nevadensis S. Watson var. badius (Suks,Sierra rush,US32
JUNEN,JUMEG,Juncus mertensianus Bong. ssp. gracilis (Enge,NA,US32
JUNEN,NA,Juncus nevadensis S. Watson var. nevadensis,Sierra rush,US32
JUNIP,NA,Juniperus L.,juniper,US32
JUNO2,NA,Juncus nodosus L.,knotted rush,US32
JUNON,NA,Juncus nodosus L. var. nodosus,knotted rush,US32
JUOC,JUCAS2,Juniperus californica Carrière var. siskiyoue,NA,US32
JUOC,NA,Juniperus occidentalis Hook.,western juniper,US32
JUOC,JUOCO,Juniperus occidentalis Hook. var. occidentali,NA,US32
JUOC,SAOC9,Sabina occidentalis (Hook.) A. Heller,NA,US32
JUOC2,NA,Juncus occidentalis Wiegand,western rush,US32
JUOC2,JUTEC,Juncus tenuis Willd. var. congestus Engelm.,NA,US32
JUOR,NA,Juncus orthophyllus Coville,straightleaf rush,US32
JUOS,JUME7,Juniperus megalocarpa Sudw.,NA,US32
JUOS,JUKN,Juniperus knightii A. Nelson,NA,US32
JUOS,NA,Juniperus osteosperma (Torr.) Little,Utah juniper,US32
JUOS,JUCAO,Juniperus californica Carrière ssp. osteosper,NA,US32
JUOS,SAOS,Sabina osteosperma (Torr.) Antoine,NA,US32
JUOS,JUUTM,Juniperus utahensis (Engelm.) Lemmon var. meg,NA,US32
JUOS,SAUT3,Sabina utahensis (Engelm.) Rydb.,NA,US32
JUOS,JUCAO2,Juniperus californica Carrière var. osteosper,NA,US32
JUOS,JUMOK,Juniperus monosperma (Engelm.) Sarg. var. kni,NA,US32
JUOS,JUUT,Juniperus utahensis (Engelm.) Lemmon,NA,US32
JUOS,JUOCU,Juniperus occidentalis Hook. var. utahensis (,NA,US32
JUOS,JUCAU,Juniperus californica Carrière var. utahensis,NA,US32
JUPA,NA,Juncus parryi Engelm.,Parry's rush,US32
JURE,NA,Juncus regelii Buchenau,Regel's rush,US32
JURE,JUJO2,Juncus jonesii Rydb.,NA,US32
JUSA,JUENM2,Juncus ensifolius Wikstr. var. montanus (Enge,NA,US32
JUSA,JUENB,Juncus ensifolius Wikstr. var. brunnescens (R,NA,US32
JUSA,JUXIM2,Juncus xiphioides E. Mey. var. montanus Engel,NA,US32
JUSA,JUXIM,Juncus xiphioides E. Mey. var. macranthus Eng,NA,US32
JUSA,JUSAR,Juncus saximontanus A. Nelson var. robustior ,NA,US32
JUSA,NA,Juncus saximontanus A. Nelson,Rocky Mountain rush,US32
JUSC2,JUVIM,Juniperus virginiana L. var. montana Vasey,NA,US32
JUSC2,NA,Juniperus scopulorum Sarg.,Rocky Mountain juniper,US32
JUSC2,JUVIS2,Juniperus virginiana L. ssp. scopulorum (Sarg,NA,US32
JUSC2,JUVIS4,Juniperus virginiana L. var. scopulorum (Sarg,NA,US32
JUSC2,SASC5,Sabina scopulorum (Sarg.) Rydb.,NA,US32
JUSC2,JUSCC2,Juniperus scopulorum Sarg. var. columnaris Fa,NA,US32
JUTE,JUMA7,Juncus macer Gray,NA,US32
JUTE,JUTEM,Juncus tenuis Willd. var. multicornis E. Mey.,NA,US32
JUTE,NA,Juncus tenuis Willd.,poverty rush,US32
JUTE,JUTEW,Juncus tenuis Willd. var. williamsii Fernald,NA,US32
JUTI,NA,Juncus tiehmii Ertter,Nevada rush,US32
JUTO,NA,Juncus torreyi Coville,Torrey's rush,US32
JUTR,NA,Juncus tracyi Rydb.,Tracy's rush,US32
JUTR6,NA,Juncus trilocularis Zika,foothill rush,US32
JUUN,NA,Juncus uncialis Greene,twelfth rush,US32
JUXI,NA,Juncus xiphioides E. Mey.,irisleaf rush,US32
KACA,NA,Kallstroemia californica (S. Watson) Vail,California caltrop,US32
KACA,KABR2,Kallstroemia brachystylis Vail,NA,US32
KACA,KACAB2,Kallstroemia californica (S. Watson) Vail var,NA,US32
KALLS,NA,Kallstroemia Scop.,caltrop,US32
KALMI,NA,Kalmia L.,laurel,US32
KAMI,KAOC,Kalmia occidentalis Small,NA,US32
KAMI,KAMIO,Kalmia microphylla (Hook.) A. Heller ssp. occ,NA,US32
KAMI,KAPOO,Kalmia polifolia Wangenh. ssp. occidentalis (,NA,US32
KAMI,KAPOM3,Kalmia polifolia Wangenh. ssp. microphylla (H,NA,US32
KAMI,NA,Kalmia microphylla (Hook.) A. Heller,alpine laurel,US32
KAMI,KAPOM2,Kalmia polifolia Wangenh. var. microphylla (H,NA,US32
KAMI,KAMIO2,Kalmia microphylla (Hook.) A. Heller var. occ,NA,US32
KAPA,NA,Kallstroemia parviflora J.B.S. Norton,warty caltrop,US32
KAPA,KAIN3,Kallstroemia intermedia Rydb.,NA,US32
KEAN,NA,Keckiella antirrhinoides (Benth.) Straw,snapdragon penstemon,US32
KEANM,KEANM2,Keckiella antirrhinoides (Benth.) Straw var. ,NA,US32
KEANM,NA,Keckiella antirrhinoides (Benth.) Straw ssp. ,snapdragon penstemon,US32
KEANM,PEANM,Penstemon antirrhinoides Benth. ssp. microphy,NA,US32
KEANM,PEMI12,Penstemon microphyllus A. Gray,NA,US32
KEBR,NA,Keckiella breviflora (Lindl.) Straw,bush beardtongue,US32
KEBRB,KEBRB2,Keckiella breviflora (Lindl.) Straw var. brev,NA,US32
KEBRB,NA,Keckiella breviflora (Lindl.) Straw ssp. brev,bush beardtongue,US32
KEBRB,PEBR15,Penstemon breviflorus Lindl.,NA,US32
KEBRG,PEBRG,Penstemon breviflorus Lindl. ssp. glabrisepal,NA,US32
KEBRG,NA,Keckiella breviflora (Lindl.) Straw ssp. glab,bush beardtongue,US32
KEBRG,KEBRG2,Keckiella breviflora (Lindl.) Straw var. glab,NA,US32
KECKI,NA,Keckiella Straw,keckiella,US32
KEGA,NA,Kelloggia galioides Torr.,milk kelloggia,US32
KELE,PELE13,Penstemon lemmonii A. Gray,NA,US32
KELE,NA,Keckiella lemmonii (A. Gray) Straw,Lemmon's keckiella,US32
KELLO,NA,Kelloggia Torr. ex Benth.,kelloggia,US32
KERO,NA,Keckiella rothrockii (A. Gray) Straw,Rothrock's keckiella,US32
KEROR,NA,Keckiella rothrockii (A. Gray) Straw ssp. rot,Rothrock's keckiella,US32
KEROR,PERO8,Penstemon rothrockii A. Gray,NA,US32
KEROR,KEROR3,Keckiella rothrockii (A. Gray) Straw var. rot,NA,US32
KOELE,NA,Koeleria Pers.,Junegrass,US32
KOMA,KOCRL,Koeleria cristata Pers. var. longifolia Vasey,NA,US32
KOMA,KOCRP,Koeleria cristata Pers. var. pinetorum Abrams,NA,US32
KOMA,KOGR2,Koeleria gracilis Pers.,NA,US32
KOMA,KONI,"Koeleria nitida Nutt., nom. utique rej.",NA,US32
KOMA,KOPY,Koeleria pyramidata auct. non (Lam.) P. Beauv,NA,US32
KOMA,NA,Koeleria macrantha (Ledeb.) Schult.,prairie Junegrass,US32
KOMA,KOAL5,Koeleria albescens auct.,NA,US32
KOMA,KOYU,Koeleria yukonensis Hultén,NA,US32
KOMA,KOCR,Koeleria cristata auct. non Pers. p.p.,NA,US32
KRAME,NA,Krameria L.,ratany,US32
KRASC,NA,Krascheninnikovia Guldenstaedt,winterfat,US32
KRER,KRPA,Krameria parvifolia Benth.,NA,US32
KRER,KRPAG,Krameria parvifolia Benth. var. glandulosa (R,NA,US32
KRER,KRGL,Krameria glandulosa Rose & Painter,NA,US32
KRER,NA,Krameria erecta Willd. ex Schult.,littleleaf ratany,US32
KRER,KRPAI,Krameria parvifolia Benth. var. imparata J.F.,NA,US32
KRER,KRIM,Krameria imparata (J.F. Macbr.) Britton,NA,US32
KRGR,NA,Krameria grayi Rose & Painter,white ratany,US32
KRLA2,NA,Krascheninnikovia lanata (Pursh) A. Meeuse & ,winterfat,US32
KRLA2,CELAR2,Ceratoides lanata (Pursh) J.T. Howell var. ru,NA,US32
KRLA2,CELA4,Ceratoides lanata (Pursh) J.T. Howell,NA,US32
KRLA2,EULA5,Eurotia lanata (Pursh) Moq.,NA,US32
KRLA2,CELAS2,Ceratoides lanata (Pursh) J.T. Howell var. su,NA,US32
KRLA2,EULAS,Eurotia lanata (Pursh) Moq. var. subspinosa (,NA,US32
LAAM,LAAMA,Lamium amplexicaule L. var. album A.L. Picken,NA,US32
LAAM,NA,Lamium amplexicaule L.,henbit deadnettle,US32
LABR,NA,Lathyrus brachycalyx Rydb.,Bonneville pea,US32
LABRB,LAOR2,Lathyrus ornatus Nutt.,NA,US32
LABRB,NA,Lathyrus brachycalyx Rydb. ssp. brachycalyx,Bonneville pea,US32
LABRZ2,NA,Lathyrus brachycalyx Rydb. ssp. zionis (C.L. ,bush pea,US32
LABRZ2,LABRZ,Lathyrus brachycalyx Rydb. var. zionis (C.L. ,NA,US32
LABRZ2,LAZI3,Lathyrus zionis C.L. Hitchc.,NA,US32
LACO13,NA,Laennecia coulteri (A. Gray) G.L. Nesom,Coulter's horseweed,US32
LACO13,ESCO2,Eschenbachia coulteri (A. Gray) Rydb.,NA,US32
LACO13,COCOV2,Conyza coulteri A. Gray var. virgata (Benth.),NA,US32
LACO13,COCO4,Conyza coulteri A. Gray,NA,US32
LACTU,NA,Lactuca L.,lettuce,US32
LAENN,NA,Laennecia Cass.,horseweed,US32
LAGL5,NA,Layia glandulosa (Hook.) Hook. & Arn.,whitedaisy tidytips,US32
LAGL5,LAGLL2,Layia glandulosa (Hook.) Hook. & Arn. ssp. lu,NA,US32
LAGOP,NA,Lagophylla Nutt.,hareleaf,US32
LAGR9,NA,Lathyrus grimesii Barneby,Grimes' pea,US32
LAHI4,NA,Lathyrus hitchcockianus Barneby & Reveal,Bullfrog Mountain pea,US32
LALA3,NA,Lathyrus lanszwertii Kellogg,Nevada pea,US32
LALA4,NA,Lathyrus latifolius L.,perennial pea,US32
LALA4,LALAS2,Lathyrus latifolius L. var. splendens Groenl.,NA,US32
LALA6,LALAL,Lathyrus lanszwertii Kellogg var. laetivirens,NA,US32
LALA6,LALAP,Lathyrus lanszwertii Kellogg var. pallescens ,NA,US32
LALA6,LALEL,Lathyrus leucanthus Rydb. var. laetivirens (G,NA,US32
LALA6,NA,Lathyrus laetivirens Greene ex Rydb.,aspen pea,US32
LALAB2,LASC7,Lathyrus schaffneri Rydb.,NA,US32
LALAB2,LAPAB,Lathyrus pauciflorus Fernald ssp. brownii (Ea,NA,US32
LALAB2,LABR2,Lathyrus brownii Eastw.,NA,US32
LALAB2,NA,Lathyrus lanszwertii Kellogg var. brownii (Ea,Brown's pea,US32
LALAL2,NA,Lathyrus lanszwertii Kellogg var. lanszwertii,Lanszwert's pea,US32
LAMIU,NA,Lamium L.,deadnettle,US32
LANE3,NA,Lathyrus nevadensis S. Watson,Sierra pea,US32
LANEC,NA,Lathyrus nevadensis S. Watson ssp. cusickii (,Sierra pea,US32
LANEC,LACU2,Lathyrus cusickii S. Watson,NA,US32
LANEC,LANEC2,Lathyrus nevadensis S. Watson var. cusickii (,NA,US32
LANGL,NA,Langloisia Greene,langloisia,US32
LAOC3,NA,Lappula occidentalis (S. Watson) Greene,flatspine stickseed,US32
LAOCC,LATEH2,Lappula texana (Scheele) Britton var. homospe,NA,US32
LAOCC,LAREC,Lappula redowskii (Hornem.) Greene var. cupul,NA,US32
LAOCC,LARET,Lappula redowskii (Hornem.) Greene var. texan,NA,US32
LAOCC,NA,Lappula occidentalis (S. Watson) Greene var. ,flatspine stickseed,US32
LAOCC,LATEH,Lappula texana (Scheele) Britton var. heteros,NA,US32
LAOCC,LATE3,Lappula texana (Scheele) Britton,NA,US32
LAOCC,LATEC,Lappula texana (Scheele) Britton var. coronat,NA,US32
LAOCO,LARED,Lappula redowskii (Hornem.) Greene var. deser,NA,US32
LAOCO,LARE,Lappula redowskii auct. non (Hornem.) Greene,NA,US32
LAOCO,NA,Lappula occidentalis (S. Watson) Greene var. ,flatspine stickseed,US32
LAOCO,LAREO,Lappula redowskii (Hornem.) Greene var. occid,NA,US32
LAOCO,LARER,Lappula redowskii (Hornem.) Greene var. redow,NA,US32
LAOCO,LAECO,Lappula echinata Gilib. var. occidentalis (S.,NA,US32
LAPPU,NA,Lappula Moench,stickseed,US32
LARA,NA,Lagophylla ramosissima Nutt.,branched lagophylla,US32
LARAR,NA,Lagophylla ramosissima Nutt. ssp. ramosissima,branched lagophylla,US32
LARI,NA,Lathyrus rigidus T.G. White,stiff pea,US32
LARRE,NA,Larrea Cav.,creosote bush,US32
LASA,NA,Lactuca saligna L.,willowleaf lettuce,US32
LASA,LASAR,Lactuca saligna L. var. runcinata Gren. & God,NA,US32
LASE,LASC6,Lactuca scariola L.,NA,US32
LASE,NA,Lactuca serriola L.,prickly lettuce,US32
LASE3,NA,Langloisia setosissima (Torr. & A. Gray ex To,Great Basin langloisia,US32
LASEP,LAPU5,Langloisia punctata (A. Gray ex Coville) Good,NA,US32
LASEP,NA,Langloisia setosissima (Torr. & A. Gray ex To,Great Basin langloisia,US32
LASEP,LALA8,Langloisia lanata Brand,NA,US32
LASES,NA,Langloisia setosissima (Torr. & A. Gray ex To,Great Basin langloisia,US32
LASES,LASEC,Langloisia setosissima (Torr. & A. Gray ex To,NA,US32
LASQ,LAFR5,Lappula fremontii (Torr.) Greene,NA,US32
LASQ,LAMY3,Lappula myosotis Moench,NA,US32
LASQ,LASQE,Lappula squarrosa (Retz.) Dumort. var. erecta,NA,US32
LASQ,LAEC,Lappula echinata Gilib.,NA,US32
LASQ,NA,Lappula squarrosa (Retz.) Dumort.,European stickseed,US32
LASQ,LAER4,Lappula erecta A. Nelson,NA,US32
LASQ,LALA11,"Lappula lappula (L.) Karst., nom. inval.",NA,US32
LATA,NA,Lactuca tatarica (L.) C.A. Mey.,blue lettuce,US32
LATAP,MUPU3,Mulgedium pulchellum (Pursh) G. Don,NA,US32
LATAP,LAPU,Lactuca pulchella (Pursh) DC.,NA,US32
LATAP,NA,Lactuca tatarica (L.) C.A. Mey. var. pulchell,blue lettuce,US32
LATAP,LATAH,Lactuca tatarica (L.) C.A. Mey. var. heteroph,NA,US32
LATAP,SOTA,Sonchus tataricus L. p.p.,NA,US32
LATAP,LAOB2,Lactuca oblongifolia Nutt.,NA,US32
LATAP,LATAP2,Lactuca tatarica (L.) C.A. Mey. ssp. pulchell,NA,US32
LATE6,NA,Lathrocasis tenerrima (A. Gray) L.A. Johnson,delicate gilia,US32
LATE6,GITE,Gilia tenerrima A. Gray,NA,US32
LATHR,NA,Lathrocasis L.A. Johnson,lathrocasis,US32
LATHY,NA,Lathyrus L.,pea,US32
LATR2,NA,Larrea tridentata (DC.) Coville,creosote bush,US32
LATRT,NA,Larrea tridentata (DC.) Coville var. tridenta,creosote bush,US32
LATRT,LAGL11,Larrea glutinosa Engelm.,NA,US32
LATRT,LADI2,Larrea divaricata auct. non Cav.,NA,US32
LATRT,LADIT,Larrea divaricata Cav. ssp. tridentata (DC.) ,NA,US32
LATRT,COTR10,Covillea tridentata (DC.) Vail,NA,US32
LATRT,LAME6,Larrea mexicana Moric.,NA,US32
LAYIA,NA,Layia Hook. & Arn. ex DC.,tidytips,US32
LEAL,NA,Lesquerella alpina (Nutt.) S. Watson,alpine bladderpod,US32
LEALA5,VEAL9,Vesicaria alpina Nutt.,NA,US32
LEALA5,LEALL,Lesquerella alpina (Nutt.) S. Watson var. lae,NA,US32
LEALA5,NA,Lesquerella alpina (Nutt.) S. Watson var. alp,alpine bladderpod,US32
LEAU16,NA,Leptosiphon aureus (Nutt.) J.M. Porter & L.A.,golden linanthus,US32
LEAUA3,NA,Leptosiphon aureus (Nutt.) J.M. Porter & L.A.,golden linanthus,US32
LEAUA3,LIAU,Linanthus aureus (Nutt.) Greene,NA,US32
LEAUA3,LIAUA2,Linanthus aureus (Nutt.) Greene ssp. aureus,NA,US32
LEAUD,NA,Leptosiphon aureus (Nutt.) J.M. Porter & L.A.,golden linanthus,US32
LEAUD,LIAUD2,Linanthus aureus (Nutt.) Greene var. decorus ,NA,US32
LEAUD,LIAUD,Linanthus aureus (Nutt.) Greene ssp. decorus ,NA,US32
LECA2,NA,Leonurus cardiaca L.,common motherwort,US32
LECA5,THCA2,Thlaspi campestre L.,NA,US32
LECA5,NECA5,Neolepia campestris (L.) W.A. Weber,NA,US32
LECA5,NA,Lepidium campestre (L.) W.T. Aiton,field pepperweed,US32
LECAC7,NA,Leonurus cardiaca L. ssp. cardiaca,common motherwort,US32
LECAN4,NA,Lecanora Ach.,rim lichen,US32
LECI18,NA,Leptosiphon ciliatus (Benth.) Jeps.,whiskerbrush,US32
LECI4,ANPI6,Aneurolepidium piperi (Bowden) Baum,NA,US32
LECI4,ELCOP,Elymus condensatus J. Presl var. pubens Piper,NA,US32
LECI4,NA,Leymus cinereus (Scribn. & Merr.) Á. Löve,basin wildrye,US32
LECI4,ELCI2,Elymus cinereus Scribn. & Merr.,NA,US32
LECI4,ELPI2,Elymus piperi Bowden,NA,US32
LECI4,ELCIP,Elymus cinereus Scribn. & Merr. var. pubens (,NA,US32
LECIC2,LICIC,Linanthus ciliatus (Benth.) Greene var. cilia,NA,US32
LECIC2,GICI2,Gilia ciliata Benth.,NA,US32
LECIC2,LICI,Linanthus ciliatus (Benth.) Greene,NA,US32
LECIC2,NA,Leptosiphon ciliatus (Benth.) Jeps. ssp. cili,whiskerbrush,US32
LECIN,LINE3,Linanthus neglectus Greene,NA,US32
LECIN,LICIN,Linanthus ciliatus (Benth.) Greene var. negle,NA,US32
LECIN,NA,Leptosiphon ciliatus (Benth.) Jeps. ssp. negl,whiskerbrush,US32
LECO7,LEKIC3,Lesquerella kingii S. Watson var. cordiformis,NA,US32
LECO7,NA,Lesquerella cordiformis (Rollins) Rollins & S,Wassuk Range bladderpod,US32
LECO7,LEKIN,Lesquerella kingii S. Watson var. nevadensis ,NA,US32
LEDA2,LEMOD2,Lepidium montanum Nutt. ssp. davisii (Rollins,NA,US32
LEDA2,NA,Lepidium davisii Rollins,Davis' pepperweed,US32
LEDI2,NA,Lepidium dictyotum A. Gray,alkali pepperweed,US32
LEDID,NA,Lepidium dictyotum A. Gray var. dictyotum,alkali pepperweed,US32
LEDUM,NA,Ledum L.,Labrador tea,US32
LEERS,NA,Leersia Sw.,cutgrass,US32
LEFL2,NA,Lepidium flavum Torr.,yellow pepperweed,US32
LEFLF2,NA,Lepidium flavum Torr. var. flavum,yellow pepperweed,US32
LEFR2,NA,Lepidium fremontii S. Watson,desert pepperweed,US32
LEFRF,NA,Lepidium fremontii S. Watson var. fremontii,desert pepperweed,US32
LEFU21,DIFU7,Diplachne fusca (L.) P. Beauv. ex Roem. & Sch,NA,US32
LEFU21,NA,Leptochloa fusca (L.) Kunth,Malabar sprangletop,US32
LEFUF,LEAC2,Leptochloa acuminata (Nash) Mohlenbr.,NA,US32
LEFUF,DIAC3,Diplachne acuminata Nash,NA,US32
LEFUF,LEFAA,Leptochloa fascicularis (Lam.) A. Gray var. a,NA,US32
LEFUF,NA,Leptochloa fusca (L.) Kunth ssp. fascicularis,bearded sprangletop,US32
LEFUF,LEFA,Leptochloa fascicularis (Lam.) A. Gray,NA,US32
LEFUF,DIFA4,Diplachne fascicularis (Lam.) P. Beauv.,NA,US32
LEFUF,LEFAM,Leptochloa fascicularis (Lam.) A. Gray var. m,NA,US32
LEFUF,DIMA10,Diplachne maritima E.P. Bicknell,NA,US32
LEFUF,LEFUF2,Leptochloa fusca (L.) Kunth var. fascicularis,NA,US32
LEFUU,MEUN4,Megastachya uninervia J. Presl,NA,US32
LEFUU,NA,Leptochloa fusca (L.) Kunth ssp. uninervia (J,Mexican sprangletop,US32
LEFUU,LEUN2,Leptochloa uninervia (J. Presl) Hitchc. & Cha,NA,US32
LEFUU,DIUN5,Diplachne uninervia (J. Presl) Parodi,NA,US32
LEGI,NA,Lemna gibba L.,swollen duckweed,US32
LEGL,LEGLC,Ledum glandulosum Nutt. var. californicum (Ke,NA,US32
LEGL,LEGRG3,Ledum groenlandicum Oeder ssp. glandulosum (N,NA,US32
LEGL,NA,Ledum glandulosum Nutt.,western Labrador tea,US32
LEGO3,NA,Lesquerella goodrichii Rollins,Tunnel Springs Mountain bladderpod,US32
LEHA11,NA,Leptosiphon harknessii (Curran) J.M. Porter &,Harkness' flaxflower,US32
LEHA11,LIHAC,Linanthus harknessii (Curran) Greene ssp. con,NA,US32
LEHA11,LIHA,Linanthus harknessii (Curran) Greene,NA,US32
LEHA11,LIHAH,Linanthus harknessii (Curran) Greene ssp. har,NA,US32
LEHI3,NA,Lesquerella hitchcockii Munz,Hitchcock's bladderpod,US32
LEHI3,PHHIC,Physaria hitchcockii (Munz) O'Kane & Al-Shehb,NA,US32
LEHI3,LEHIC3,Lesquerella hitchcockii Munz ssp. confluens M,NA,US32
LEKI,NA,Lesquerella kingii S. Watson,King bladderpod,US32
LEKI2,FECO5,Festuca confinis Vasey,NA,US32
LEKI2,FEKI2,Festuca kingii (S. Watson) Cassidy,NA,US32
LEKI2,HEKI,Hesperochloa kingii (S. Watson) Rydb.,NA,US32
LEKI2,NA,Leucopoa kingii (S. Watson) W.A. Weber,spike fescue,US32
LEKI2,POKI,Poa kingii S. Watson,NA,US32
LEKIC2,NA,Lesquerella kingii S. Watson ssp. kingii var.,King bladderpod,US32
LEKIK,NA,Lesquerella kingii S. Watson ssp. kingii,King bladderpod,US32
LEKIK2,PHKI,Physaria kingii (S. Watson) O'Kane & Al-Shehb,NA,US32
LEKIK2,NA,Lesquerella kingii S. Watson ssp. kingii var.,King bladderpod,US32
LEKIK2,PHKIK,Physaria kingii (S. Watson) O'Kane & Al-Shehb,NA,US32
LEKIL,LELA14,Lesquerella latifolia A. Nelson,NA,US32
LEKIL,LEBA2,Lesquerella barnebyi Maguire,NA,US32
LEKIL,PHKIL,Physaria kingii (S. Watson) O'Kane & Al-Shehb,NA,US32
LEKIL,LEOCP,Lesquerella occidentalis S. Watson var. parvi,NA,US32
LEKIL,LEKIP,Lesquerella kingii S. Watson var. parviflora ,NA,US32
LEKIL,NA,Lesquerella kingii S. Watson ssp. latifolia (,King bladderpod,US32
LELA,NA,Lepidium lasiocarpum Nutt.,shaggyfruit pepperweed,US32
LELA2,CALA80,Cardaria latifolia (L.) Spach,NA,US32
LELA2,NA,Lepidium latifolium L.,broadleaved pepperweed,US32
LELA4,NA,Lepidospartum latisquamum S. Watson,Nevada broomsage,US32
LELAL,LELAR,Lepidium lasiocarpum Nutt. var. rotundum C.L.,NA,US32
LELAL,LELAG,Lepidium lasiocarpum Nutt. var. georginum (Ry,NA,US32
LELAL,LELAT,Lepidium lasiocarpum Nutt. var. typicum C.L. ,NA,US32
LELAL,NA,Lepidium lasiocarpum Nutt. var. lasiocarpum,shaggyfruit pepperweed,US32
LELE13,NA,Lessingia lemmonii A. Gray,Lemmon's lessingia,US32
LELEP,LEGEP3,Lessingia germanorum Cham. var. peirsonii J.T,NA,US32
LELEP,NA,Lessingia lemmonii A. Gray var. peirsonii (J.,Peirson's lessingia,US32
LELER2,LEGER,Lessingia germanorum Cham. var. ramulosissima,NA,US32
LELER2,NA,Lessingia lemmonii A. Gray var. ramulosissima,Lemmon's lessingia,US32
LELI14,LILIL,Linanthus liniflorus (Benth.) Greene ssp. lin,NA,US32
LELI14,LIPH3,Linanthus pharnaceoides (Benth.) Greene,NA,US32
LELI14,LILIP2,Linanthus liniflorus (Benth.) Greene var. pha,NA,US32
LELI14,NA,Leptosiphon liniflorus (Benth.) J.M. Porter &,narrowflower flaxflower,US32
LELI14,GIPH2,Gilia pharnaceoides Benth.,NA,US32
LELI14,LILI2,Linanthus liniflorus (Benth.) Greene,NA,US32
LELI14,LILIP,Linanthus liniflorus (Benth.) Greene ssp. pha,NA,US32
LELU,NA,Lesquerella ludoviciana (Nutt.) S. Watson,foothill bladderpod,US32
LEMA3,NA,Lewisia maguirei A.H. Holmgren,Maguire's lewisia,US32
LEMI3,LEMI2,Lemna minima Chevall. ex Schleid.,NA,US32
LEMI3,NA,Lemna minor L.,common duckweed,US32
LEMI3,LECY4,Lemna cyclostasa Elliott ex Schleid.,NA,US32
LEMI6,LEVAM,Lemna valdiviana Phil. var. minima (Phil.) He,NA,US32
LEMI6,LEMI10,"Lemna minima Phil., non Thuill. ex P. Beauv.",NA,US32
LEMI6,LEVAA,Lemna valdiviana Phil. var. abbreviata Hegelm,NA,US32
LEMI6,NA,Lemna minuta Kunth,least duckweed,US32
LEMI6,LEMI9,Lemna minuscula Herter,NA,US32
LEMNA,NA,Lemna L.,duckweed,US32
LEMO2,NA,Lepidium montanum Nutt.,mountain pepperweed,US32
LEMO4,NA,Leucocrinum montanum Nutt. ex A. Gray,common starlily,US32
LEMOC,LEMOC3,Lepidium montanum Nutt. ssp. canescens (Thell,NA,US32
LEMOC,NA,Lepidium montanum Nutt. var. canescens (Thell,mountain pepperweed,US32
LEMOC4,LEMOS2,Lepidium montanum Nutt. var. stelliae S.L. We,NA,US32
LEMOC4,NA,Lepidium montanum Nutt. var. cinereum (C.L. H,mountain pepperweed,US32
LEMOC4,LEMOC2,Lepidium montanum Nutt. ssp. cinereum (C.L. H,NA,US32
LEMOJ,LEJO,Lepidium jonesii Rydb.,NA,US32
LEMOJ,NA,Lepidium montanum Nutt. var. jonesii (Rydb.) ,Jones' pepperweed,US32
LEMOM,NA,Lepidium montanum Nutt. var. montanum,mountain pepperweed,US32
LEMON2,NA,Lepidium montanum Nutt. var. nevadense Rollin,mountain pepperweed,US32
LENA2,NA,Lepidium nanum S. Watson,dwarf pepperweed,US32
LENA3,CHNA3,Chamaesaracha nana (A. Gray) A. Gray,NA,US32
LENA3,NA,Leucophysalis nana (A. Gray) Averett,dwarf chamaesaracha,US32
LENE5,LEPYN,Lewisia pygmaea (A. Gray) B.L. Rob. var. neva,NA,US32
LENE5,NA,Lewisia nevadensis (A. Gray) B.L. Rob.,Nevada lewisia,US32
LENE5,ORNE2,Oreobroma nevadense (A. Gray) Howell,NA,US32
LENI,NA,Lepidium nitidum Nutt.,shining pepperweed,US32
LENIN,NA,Lepidium nitidum Nutt. var. nitidum,shining pepperweed,US32
LENIN,LENII,Lepidium nitidum Nutt. var. insigne Greene,NA,US32
LENU8,NA,Leptosiphon nuttallii (A. Gray) J.M. Porter &,Nuttall's linanthus,US32
LENUN,LENU5,Leptodactylon nuttallii (A. Gray) Rydb.,NA,US32
LENUN,LINU3,Linanthus nuttallii (A. Gray) Greene ex Milli,NA,US32
LENUN,LENUT2,Leptosiphon nuttallii (A. Gray) J.M. Porter &,NA,US32
LENUN,GINU,Gilia nuttallii A. Gray,NA,US32
LENUN,LINUN,Linanthus nuttallii (A. Gray) Greene ex Milli,NA,US32
LENUN,LINU4,Linanthastrum nuttallii (A. Gray) Ewan,NA,US32
LENUN,LINUT,Linanthus nuttallii (A. Gray) Greene ex Milli,NA,US32
LENUN,NA,Leptosiphon nuttallii (A. Gray) J.M. Porter &,Nuttall's linanthus,US32
LENUP,LINUP,Linanthus nuttallii (A. Gray) Greene ex Milli,NA,US32
LENUP,NA,Leptosiphon nuttallii (A. Gray) J.M. Porter &,Nuttall's linanthus,US32
LENUP,LINUP2,Linanthastrum nuttallii (A. Gray) Ewan var. p,NA,US32
LEOC,NA,Lesquerella occidentalis S. Watson,western bladderpod,US32
LEOCC2,LEOCC,Lesquerella occidentalis S. Watson var. ciner,NA,US32
LEOCC2,NA,Lesquerella occidentalis S. Watson ssp. ciner,western bladderpod,US32
LEOCO,LEOCC4,Lesquerella occidentalis S. Watson var. cusic,NA,US32
LEOCO,LECU4,Lesquerella cusickii M.E. Jones,NA,US32
LEOCO,NA,Lesquerella occidentalis S. Watson ssp. occid,western bladderpod,US32
LEOCO,PHOC5,Physaria occidentalis (S. Watson) O'Kane & Al,NA,US32
LEOCO,PHOCO2,Physaria occidentalis (S. Watson) O'Kane & Al,NA,US32
LEOCO,LEOCC3,Lesquerella occidentalis S. Watson ssp. cusic,NA,US32
LEONT,NA,Leontodon L.,hawkbit,US32
LEONU,NA,Leonurus L.,motherwort,US32
LEOR,PHOR5,Phalaris oryzoides L.,NA,US32
LEOR,NA,Leersia oryzoides (L.) Sw.,rice cutgrass,US32
LEOR,HOOR3,Homalocenchrus oryzoides (L.) Pollich,NA,US32
LEPA50,LINUP3,Linanthastrum nuttallii (A. Gray) Ewan var. p,NA,US32
LEPA50,LIPA10,Linanthus pachyphyllus R. Patt.,NA,US32
LEPA50,NA,Leptosiphon pachyphyllus (R. Patt.) J.M. Port,Sierra linanthus,US32
LEPA6,DIPA26,Dinebra panicea (Retz.) P.M. Peterson & N. Sn,NA,US32
LEPA6,NA,Leptochloa panicea (Retz.) Ohwi,mucronate sprangletop,US32
LEPAB,FEFI2,Festuca filiformis Lam.,NA,US32
LEPAB,LEFIP,Leptochloa filiformis (Lam.) P. Beauv. var. p,NA,US32
LEPAB,LEFI,Leptochloa filiformis (Lam.) P. Beauv.,NA,US32
LEPAB,NA,Leptochloa panicea (Retz.) Ohwi ssp. brachiat,mucronate sprangeltop,US32
LEPAB,LEBR17,Leptochloa brachiata Steud.,NA,US32
LEPE2,NA,Lepidium perfoliatum L.,clasping pepperweed,US32
LEPE24,NA,Lesquerella pendula Rollins,Snake Range bladderpod,US32
LEPID,NA,Lepidium L.,pepperweed,US32
LEPID2,NA,Lepidospartum (A. Gray) A. Gray,broomsage,US32
LEPTO,NA,Leptochloa P. Beauv.,sprangletop,US32
LEPTO22,NA,Leptosiphon Benth.,leptosiphon,US32
LEPY2,LEPYA,Lewisia pygmaea (A. Gray) B.L. Rob. var. arid,NA,US32
LEPY2,NA,Lewisia pygmaea (A. Gray) B.L. Rob.,alpine lewisia,US32
LEPY2,LESI3,Lewisia sierrae Ferris,NA,US32
LEPY2,ORPY2,Oreobroma pygmaeum (A. Gray) Howell,NA,US32
LEPY2,TAPY,Talinum pygmaeum A. Gray,NA,US32
LEPY2,LEMI11,Lewisia minima (A. Nelson) A. Nelson,NA,US32
LERA2,NA,Lepidium ramosissimum A. Nelson,manybranched pepperweed,US32
LERAB2,LEBO,Lepidium bourgeauanum Thell.,NA,US32
LERAB2,LEDEB2,Lepidium densiflorum Schrad. var. bourgeauanu,NA,US32
LERAB2,NA,Lepidium ramosissimum A. Nelson var. bourgeau,Bourgeau's pepperweed,US32
LERE7,NA,Lewisia rediviva Pursh,bitter root,US32
LEREM,NA,Lewisia rediviva Pursh var. minor (Rydb.) Mun,bitter root,US32
LEREM,LEMI12,Lewisia minor Rydb.,NA,US32
LEREM,LEREM2,Lewisia rediviva Pursh ssp. minor (Rydb.) A.H,NA,US32
LERER,NA,Lewisia rediviva Pursh var. rediviva,bitter root,US32
LERU4,LETU,Lesquerella tumulosa (Barneby) Reveal,NA,US32
LERU4,NA,Lesquerella rubicundula Rollins,tum bladderpod,US32
LERU4,LEHIR,Lesquerella hitchcockii Munz ssp. rubicundula,NA,US32
LESA4,NA,Leymus salinus (M.E. Jones) Á. Löve,saline wildrye,US32
LESAS,ELSA,Elymus salinus M.E. Jones,NA,US32
LESAS,ELAMS,Elymus ambiguus Vasey & Scribn. var. strigosu,NA,US32
LESAS,ELAMS3,Elymus ambiguus Vasey & Scribn. var. salinus ,NA,US32
LESAS,ELST7,Elymus strigosus Rydb.,NA,US32
LESAS,NA,Leymus salinus (M.E. Jones) Á. Löve ssp. sali,saline wildrye,US32
