symbol,synonym_symbol,scientific_name,common_name,fips_code
ABCO,ABCOC,Abies concolor (Gord. & Glend.) Lindl. ex Hil,NA,US32
ABCO,NA,Abies concolor (Gord. & Glend.) Lindl. ex Hil,white fir,US32
ABEL,ABFRE2,Abronia fragrans Nutt. ex Hook. var. elliptic,NA,US32
ABEL,ABPU2,Abronia pumila Rydb.,NA,US32
ABEL,NA,Abronia elliptica A. Nelson,fragrant white sand verbena,US32
ABEL,ABRA,Abronia ramosa Standl.,NA,US32
ABEL,ABSA3,Abronia salsa Rydb.,NA,US32
ABIES,NA,Abies Mill.,fir,US32
ABLA,NA,Abies lasiocarpa (Hook.) Nutt.,subalpine fir,US32
ABLAL,ABLAB,Abies lasiocarpa (Hook.) Nutt. ssp. bifolia (,NA,US32
ABLAL,NA,Abies lasiocarpa (Hook.) Nutt. var. lasiocarp,subalpine fir,US32
ABLAL,ABBAF,Abies balsamea (L.) Mill. var. fallax (Engelm,NA,US32
ABLAL,ABBAL,Abies balsamea (L.) Mill. ssp. lasiocarpa (Ho,NA,US32
ABLAL,ABSU,Abies subalpina Engelmann,NA,US32
ABLAL,ABLAB2,Abies lasiocarpa (Hook.) Nutt. var. bifolia (,NA,US32
ABLAL,ABBI3,Abies bifolia A. Murray bis,NA,US32
ABLO,NA,Abies lowiana (Gordon & Glend.) A. Murray bis,Sierra white fir,US32
ABLO,ABCOL,Abies concolor (Gord. & Glend.) Lindl. ex Hil,NA,US32
ABMA,NA,Abies magnifica A. Murray bis,California red fir,US32
ABNA,NA,Abronia nana S. Watson,dwarf sand verbena,US32
ABNAC,NA,Abronia nana S. Watson var. covillei (Heimerl,Coville's dwarf sand verbena,US32
ABNAC,ABNAC2,Abronia nana S. Watson ssp. covillei (Heimerl,NA,US32
ABNAN,NA,Abronia nana S. Watson var. nana,dwarf sand verbena,US32
ABNAN,ABNAL,Abronia nana S. Watson var. lanciformis M.E. ,NA,US32
ABPA3,NA,Abutilon parvulum A. Gray,dwarf Indian mallow,US32
ABPO,NA,Abronia pogonantha Heimerl,Mojave sand verbena,US32
ABRON,NA,Abronia Juss.,sand verbena,US32
ABTH,ABAV,Abutilon avicennae Gaertn.,NA,US32
ABTH,ABAB3,"Abutilon abutilon (L.) Rusby, nom. inval.",NA,US32
ABTH,NA,Abutilon theophrasti Medik.,velvetleaf,US32
ABTU,ABOR2,Abronia orbiculata Standl.,NA,US32
ABTU,NA,Abronia turbinata Torr. ex S. Watson,transmontane sand verbena,US32
ABTU,ABEX,Abronia exalata Standl.,NA,US32
ABUTI,NA,Abutilon Mill.,Indian mallow,US32
ABVI,NA,Abronia villosa S. Watson,desert sand verbena,US32
ABVIV,NA,Abronia villosa S. Watson var. villosa,desert sand verbena,US32
ACAMP,NA,Acamptopappus (A. Gray) A. Gray,goldenhead,US32
ACAR14,STAR2,Stipa arida M.E. Jones,NA,US32
ACAR14,NA,Achnatherum aridum (M.E. Jones) Barkworth,Mormon needlegrass,US32
ACARO2,NA,Acarospora A. Massal.,cracked lichen,US32
ACBL,STBL4,Stipa bloomeri Bol.,NA,US32
ACBL,STBL5,Stiporyzopsis bloomeri (Bol.) B.L. Johnson,NA,US32
ACBL,NA,Achnatherum ×bloomeri (Bol.) Barkworth [hymen,NA,US32
ACBL,ORBL,Oryzopsis bloomeri (Bol.) Ricker,NA,US32
ACCO3,NA,Achyronychia cooperi Torr. & A. Gray,onyxflower,US32
ACCO4,NA,Aconitum columbianum Nutt.,Columbian monkshood,US32
ACCOC3,ACGE3,Aconitum geranioides Greene,NA,US32
ACCOC3,ACCOO,Aconitum columbianum Nutt. var. ochroleucum A,NA,US32
ACCOC3,ACCOP,Aconitum columbianum Nutt. ssp. pallidum Pipe,NA,US32
ACCOC3,ACLE6,Aconitum leibergii Greene,NA,US32
ACCOC3,ACMO3,Aconitum mogollonicum Greene,NA,US32
ACCOC3,ACCOB,Aconitum columbianum Nutt. var. bakeri (Green,NA,US32
ACCOC3,NA,Aconitum columbianum Nutt. ssp. columbianum,Columbian monkshood,US32
ACER,NA,Acer L.,maple,US32
ACGL,NA,Acer glabrum Torr.,Rocky Mountain maple,US32
ACGLD3,NA,Acer glabrum Torr. var. diffusum (Greene) Smi,Rocky Mountain maple,US32
ACGLD3,ACDI,Acer diffusum Greene,NA,US32
ACGLD3,ACGLD,Acer glabrum Torr. ssp. diffusum (Greene) A.E,NA,US32
ACGLD4,ACGLD2,Acer glabrum Torr. ssp. douglasii (Hook.) Wes,NA,US32
ACGLD4,NA,Acer glabrum Torr. var. douglasii (Hook.) Dip,Douglas maple,US32
ACGLD4,ACDO,Acer douglasii Hook.,NA,US32
ACGLG2,ACGLT3,Acer glabrum Torr. var. tripartitum (Nutt. ex,NA,US32
ACGLG2,NA,Acer glabrum Torr. var. glabrum,Rocky Mountain maple,US32
ACGLG2,ACGLT4,Acer glabrum Torr. var. typicum (Wesmael) Kel,NA,US32
ACGLG2,ACTR3,Acer tripartitum Nutt. ex Torr. & A. Gray,NA,US32
ACGLT2,NA,Acer glabrum Torr. var. torreyi (Greene) Smil,Torrey maple,US32
ACGLT2,ACGLT,Acer glabrum Torr. ssp. torreyi (Greene) A.E.,NA,US32
ACGLT2,ACTO2,Acer torreyi Greene,NA,US32
ACGR3,NA,Acer grandidentatum Nutt.,bigtooth maple,US32
ACGRG,ACSAG2,Acer saccharum Marshall ssp. grandidentatum (,NA,US32
ACGRG,NA,Acer grandidentatum Nutt. var. grandidentatum,bigtooth maple,US32
ACGRG,ACSAG3,Acer saccharum Marshall var. grandidentatum (,NA,US32
ACGRG,SAGR17,Saccharodendron grandidentatum (Nutt.) Nieuwl,NA,US32
ACHIL,NA,Achillea L.,yarrow,US32
ACHNA,NA,Achnatherum P. Beauv.,needlegrass,US32
ACHY,ERCU9,Eriocoma cuspidata Nutt.,NA,US32
ACHY,NA,Achnatherum hymenoides (Roem. & Schult.) Bark,Indian ricegrass,US32
ACHY,ORHY,Oryzopsis hymenoides (Roem. & Schult.) Ricker,NA,US32
ACHY,STHY6,Stipa hymenoides Roem. & Schult.,NA,US32
ACHYR3,NA,Achyronychia Torr. & A. Gray,achyronychia,US32
ACLE8,NA,Achnatherum lemmonii (Vasey) Barkworth,Lemmon's needlegrass,US32
ACLE9,STLE4,Stipa lettermanii Vasey,NA,US32
ACLE9,NA,Achnatherum lettermanii (Vasey) Barkworth,Letterman's needlegrass,US32
ACLEL,ACLEL2,Achnatherum lemmonii (Vasey) Barkworth ssp. l,NA,US32
ACLEL,STLE2,Stipa lemmonii (Vasey) Scribn.,NA,US32
ACLEL,STLEJ,Stipa lemmonii (Vasey) Scribn. var. jonesii S,NA,US32
ACLEL,NA,Achnatherum lemmonii (Vasey) Barkworth var. l,Lemmon's needlegrass,US32
ACLEL,STLEL,Stipa lemmonii (Vasey) Scribn. var. lemmonii,NA,US32
ACMI2,NA,Achillea millefolium L.,common yarrow,US32
ACMIA,ACLAA2,Achillea lanulosa Nutt. var. alpicola Rydb.,NA,US32
ACMIA,ACMIF,Achillea millefolium L. var. fusca (Rydb.) G.,NA,US32
ACMIA,NA,Achillea millefolium L. var. alpicola (Rydb.),common yarrow,US32
ACMIA,ACAL11,Achillea alpicola (Rydb.) Rydb.,NA,US32
ACMIA,ACFU,Achillea fusca Rydb.,NA,US32
ACMIA,ACLAA,Achillea lanulosa Nutt. ssp. alpicola (Rydb.),NA,US32
ACMIA,ACSU3,Achillea subalpina Greene,NA,US32
ACMIO,ACLA3,Achillea laxiflora Pollard & Cockerell,NA,US32
ACMIO,ACMIL,Achillea millefolium L. ssp. lanulosa (Nutt.),NA,US32
ACMIO,ACAS2,Achillea aspleniifolia auct. non Vent.,NA,US32
ACMIO,ACMIR,Achillea millefolium L. var. rosea (Desf.) To,NA,US32
ACMIO,ACTO3,"Achillea tomentosa Pursh, non L.",NA,US32
ACMIO,ACMIG2,Achillea millefolium L. var. gracilis (Raf.) ,NA,US32
ACMIO,ACER2,Achillea eradiata Piper,NA,US32
ACMIO,ACLA5,Achillea lanulosa Nutt.,NA,US32
ACMIO,NA,Achillea millefolium L. var. occidentalis DC.,western yarrow,US32
ACMIO,ACLAA3,Achillea lanulosa Nutt. var. arachnoidea Lune,NA,US32
ACMIO,ACGR5,Achillea gracilis Raf.,NA,US32
ACMIO,ACMIO2,Achillea millefolium L. ssp. occidentalis (DC,NA,US32
ACMIO,ACMIL3,Achillea millefolium L. var. lanulosa (Nutt.),NA,US32
ACMIO,ACLAE,Achillea lanulosa Nutt. var. eradiata (Piper),NA,US32
ACMIO,ACMIP5,Achillea millefolium L. ssp. pallidotegula B.,NA,US32
ACMIO,ACLAT,Achillea lanulosa Nutt. ssp. typica D.D. Keck,NA,US32
ACMIO,ACMIR2,Achillea millefolium L. var. russeolata B. Bo,NA,US32
ACMIO,ACRO4,Achillea rosea Desf.,NA,US32
ACMIO,ACMIA4,Achillea millefolium L. var. aspleniifolia (V,NA,US32
ACMIO,ACOC,Achillea occidentalis (DC.) Raf. ex Rydb.,NA,US32
ACMIO,ACAN7,Achillea angustissima Rydb.,NA,US32
ACNE10,NA,Achnatherum nevadense (B.L. Johnson) Barkwort,Nevada needlegrass,US32
ACNE10,STNE4,Stipa nevadensis B.L. Johnson,NA,US32
ACNE2,NA,Acer negundo L.,boxelder,US32
ACNE9,NA,Achnatherum nelsonii (Scribn.) Barkworth,Columbia needlegrass,US32
ACNED,STOCM,Stipa occidentalis Thurb. var. minor sensu C.,NA,US32
ACNED,STNED2,Stipa nelsonii Scribn. var. dorei (Barkworth ,NA,US32
ACNED,STCO3,"Stipa columbiana Macoun, nom. utique rej.",NA,US32
ACNED,ACNED2,Achnatherum nelsonii (Scribn.) Barkworth var.,NA,US32
ACNED,NA,Achnatherum nelsonii (Scribn.) Barkworth ssp.,Dore's needlegrass,US32
ACNED,STNED,Stipa nelsonii Scribn. ssp. dorei Barkworth &,NA,US32
ACNED,STMI6,Stipa minor (Vasey) Scribn.,NA,US32
ACNEI2,NEACI,Negundo aceroides (L.) Moench ssp. interius (,NA,US32
ACNEI2,ACNEI,Acer negundo L. ssp. interius (Britton) Á. Lö,NA,US32
ACNEI2,NEIN3,Negundo interius (Britton) Rydb.,NA,US32
ACNEI2,NA,Acer negundo L. var. interius (Britton) Sarg.,boxelder,US32
ACNEI2,ACIN3,Acer interius Britton,NA,US32
ACNEN2,STNE3,Stipa nelsonii Scribn.,NA,US32
ACNEN2,STWI,Stipa williamsii Scribn.,NA,US32
ACNEN2,STCON2,Stipa columbiana Macoun var. nelsonii (Scribn,NA,US32
ACNEN2,STOCN,Stipa occidentalis Thurb. var. nelsonii (Scri,NA,US32
ACNEN2,NA,Achnatherum nelsonii (Scribn.) Barkworth ssp.,Columbia needlegrass,US32
ACOC3,NA,Achnatherum occidentale (Thurb.) Barkworth,western needlegrass,US32
ACOCC,NA,Achnatherum occidentale (Thurb.) Barkworth ss,California needlegrass,US32
ACOCC,STCA2,Stipa californica Merr. & Burtt Davy,NA,US32
ACOCC,STNEL3,Stipa nelsonii Scribn. var. longiaristata Bar,NA,US32
ACOCC,ACNEL2,Achnatherum nelsonii (Scribn.) Barkworth ssp.,NA,US32
ACOCC,STOCC,Stipa occidentalis Thurb. var. californica (M,NA,US32
ACOCP,NA,Achnatherum occidentale (Thurb.) Barkworth ss,pubescent western needlegrass,US32
ACOCP,STEL2,Stipa elmeri Piper & Brodie ex Scribn.,NA,US32
ACOCP,STOCP,Stipa occidentalis Thurb. var. pubescens (Vas,NA,US32
ACONI,NA,Aconitum L.,monkshood,US32
ACOUR,NA,Acourtia D. Don,desertpeony,US32
ACPA13,NA,Achnatherum parishii (Vasey) Barkworth,Parish's needlegrass,US32
ACPAD,STCOD,Stipa coronata Thurb. var. depauperata (M.E. ,NA,US32
ACPAD,NA,Achnatherum parishii (Vasey) Barkworth var. d,little Parish's needlegrass,US32
ACPAP,STCOP2,Stipa coronata Thurb. var. parishii (Vasey) H,NA,US32
ACPAP,STPA17,Stipa parishii Vasey,NA,US32
ACPAP,NA,Achnatherum parishii (Vasey) Barkworth var. p,Parish's needlegrass,US32
ACPI2,NA,Achnatherum pinetorum (M.E. Jones) Barkworth,pine needlegrass,US32
ACPI2,STPI2,Stipa pinetorum M.E. Jones,NA,US32
ACRE3,NA,Acroptilon repens (L.) DC.,hardheads,US32
ACRE3,CEPI3,Centaurea picris Pall. ex Willd.,NA,US32
ACRE3,CERE6,Centaurea repens L.,NA,US32
ACROP,NA,Acroptilon Cass.,hardheads,US32
ACRU2,NA,Actaea rubra (Aiton) Willd.,red baneberry,US32
ACRUA8,ACAR7,Actaea arguta Nutt.,NA,US32
ACRUA8,ACRUA,Actaea rubra (Aiton) Willd. var. arguta (Nutt,NA,US32
ACRUA8,ACARV,Actaea arguta Nutt. var. viridiflora (Greene),NA,US32
ACRUA8,ACSPA,Actaea spicata L. var. arguta (Nutt.) Torr.,NA,US32
ACRUA8,NA,Actaea rubra (Aiton) Willd. ssp. arguta (Nutt,red baneberry,US32
ACSC5,ACAL14,Acarospora albida H. Magn.,NA,US32
ACSC5,NA,Acarospora schleicheri (Ach.) A. Massal.,Schleicher's cracked lichen,US32
ACSC5,ACBE5,Acarospora bella (Nyl.) Jatta,NA,US32
ACSC5,ACDI5,Acarospora dissipata H. Magn.,NA,US32
ACSC5,ACXA2,Acarospora xanthophana (Nyl.) Jatta,NA,US32
ACSC5,ACCH4,Acarospora chrysops (Tuck.) H. Magn.,NA,US32
ACSC5,ACEV,Acarospora evoluta H. Magn.,NA,US32
ACSC5,ACRI5,Acarospora rimulosa H. Magn.,NA,US32
ACSC5,ACCO13,Acarospora contigua H. Magn.,NA,US32
ACSC5,ACOC2,Acarospora ocellata H. Magn.,NA,US32
ACSC5,ACIN10,Acarospora intercedens H. Magn.,NA,US32
ACSC5,ACEP,Acarospora epilutescens Zahlbr.,NA,US32
ACSC5,ACRU6,Acarospora rubicunda H. Magn.,NA,US32
ACSC5,ACRH2,Acarospora rhabarbarina Hue,NA,US32
ACSC5,ACSU7,Acarospora subalbida H. Magn.,NA,US32
ACSC5,ACSU8,Acarospora subcontigua H. Magn.,NA,US32
ACSC5,ACAM6,Acarospora amabilis H. Magn.,NA,US32
ACSH,NA,Acamptopappus shockleyi A. Gray,Shockley's goldenhead,US32
ACSP,NA,Acamptopappus sphaerocephalus (Harv. & A. Gra,rayless goldenhead,US32
ACSP12,STSP3,Stipa speciosa Trin. & Rupr.,NA,US32
ACSP12,NA,Achnatherum speciosum (Trin. & Rupr.) Barkwor,desert needlegrass,US32
ACSPH,NA,Acamptopappus sphaerocephalus (Harv. & A. Gra,rayless goldenhead,US32
ACSPS2,NA,Acamptopappus sphaerocephalus (Harv. & A. Gra,rayless goldenhead,US32
ACSPS2,APSP2,Aplopappus sphaerocephalus Harv. & A. Gray ex,NA,US32
ACTAE,NA,Actaea L.,baneberry,US32
ACTH7,NA,Achnatherum thurberianum (Piper) Barkworth,Thurber's needlegrass,US32
ACTH7,STTH2,Stipa thurberiana Piper,NA,US32
ACWE3,ORWE,Oryzopsis webberi (Thurb.) Benth. ex Vasey,NA,US32
ACWE3,STWE,Stipa webberi (Thurb.) B.L. Johnson,NA,US32
ACWE3,NA,Achnatherum webberi (Thurb.) Barkworth,Webber needlegrass,US32
ACWR5,NA,Acourtia wrightii (A. Gray) Reveal & R.M. Kin,brownfoot,US32
ACWR5,PEWR4,Perezia wrightii A. Gray,NA,US32
ADAL,ADPEA2,Adiantum pedatum L. ssp. aleuticum (Rupr.) Ca,NA,US32
ADAL,NA,Adiantum aleuticum (Rupr.) Paris,Aleutian maidenhair,US32
ADAL,ADPES,Adiantum pedatum L. ssp. subpumilum (W.H. Wag,NA,US32
ADAL,ADPEA,Adiantum pedatum L. var. aleuticum Rupr.,NA,US32
ADAL,ADPEC,Adiantum pedatum L. ssp. calderi Cody,NA,US32
ADAL,ADPES2,Adiantum pedatum L. var. subpumilum W.H. Wagn,NA,US32
ADCA,ADMO2,Adiantum modestum Underw.,NA,US32
ADCA,NA,Adiantum capillus-veneris L.,common maidenhair,US32
ADCA,ADCAM,Adiantum capillus-veneris L. var. modestum (U,NA,US32
ADCA,ADCAP,Adiantum capillus-veneris L. var. protrusum F,NA,US32
ADCO2,NA,Adenophyllum cooperi (A. Gray) Strother,Cooper's dogweed,US32
ADCO2,DYCO2,Dyssodia cooperi A. Gray,NA,US32
ADENO2,NA,Adenostoma Hook. & Arn.,chamise,US32
ADENO5,NA,Adenophyllum Pers.,dogweed,US32
ADFA,NA,Adenostoma fasciculatum Hook. & Arn.,chamise,US32
ADFAF,NA,Adenostoma fasciculatum Hook. & Arn. var. fas,chamise,US32
ADIAN,NA,Adiantum L.,maidenhair fern,US32
ADPO,DYPO,Dyssodia porophylloides A. Gray,NA,US32
ADPO,NA,Adenophyllum porophylloides (A. Gray) Strothe,San Felipe dogweed,US32
AECY,TRCY3,"Triticum cylindricum (Host) Ces., Pass. & Gib",NA,US32
AECY,NA,Aegilops cylindrica Host,jointed goatgrass,US32
AECY,AETA3,Aegilops tauschii auct. non Coss.,NA,US32
AECY,AECYR,Aegilops cylindrica Host var. rubiginosa Popo,NA,US32
AECY,CYCY5,Cylindropyrum cylindricum (Host) Á. Löve,NA,US32
AEGIL,NA,Aegilops L.,goatgrass,US32
AETR,TRPE19,Triticum persicum (Boiss.) Aitch. & Hemsl.,NA,US32
AETR,TRTR5,Triticum triunciale (L.) Raspail,NA,US32
AETR,NA,Aegilops triuncialis L.,barbed goatgrass,US32
AETR,AESQ,Aegilops squarrosa L.,NA,US32
AGAST,NA,Agastache Clayton ex Gronov.,giant hyssop,US32
AGAU2,NA,Agoseris aurantiaca (Hook.) Greene,orange agoseris,US32
AGAUA,AGRO2,Agoseris rostrata Rydb.,NA,US32
AGAUA,TRAU8,Troximon aurantiacum Hook.,NA,US32
AGAUA,NA,Agoseris aurantiaca (Hook.) Greene var. auran,orange agoseris,US32
AGAUA,AGGR7,Agoseris graminifolia Greene,NA,US32
AGAUP,NA,Agoseris aurantiaca (Hook.) Greene var. purpu,orange agoseris,US32
AGAUP,AGAUP2,Agoseris aurantiaca (Hook.) Greene ssp. purpu,NA,US32
AGAVE,NA,Agave L.,agave,US32
AGCA5,AGTE,Agrostis tenuis Sibth.,NA,US32
AGCA5,AGSY2,Agrostis sylvatica Huds.,NA,US32
AGCA5,AGTEH,Agrostis tenuis Sibth. var. hispida (Willd.) ,NA,US32
AGCA5,AGTEA,Agrostis tenuis Sibth. var. aristata (Parnell,NA,US32
AGCA5,AGTEP,Agrostis tenuis Sibth. var. pumila (L.) Druce,NA,US32
AGCA5,AGVU2,Agrostis vulgaris With.,NA,US32
AGCA5,NA,Agrostis capillaris L.,colonial bentgrass,US32
AGCR,NA,Agropyron cristatum (L.) Gaertn.,crested wheatgrass,US32
AGCRP8,AGPE5,Agropyron pectiniforme Roem. & Schult.,NA,US32
AGCRP8,AGPE6,Agropyron pectinatum (M. Bieb.) P. Beauv.,NA,US32
AGCRP8,AGCR3,Agropyron cristatiforme Sarkar,NA,US32
AGCRP8,NA,Agropyron cristatum (L.) Gaertn. ssp. pectina,crested wheatgrass,US32
AGCU,NA,Agastache cusickii (Greenm.) A. Heller,Cusick's giant hyssop,US32
AGCU,AGCUP,Agastache cusickii (Greenm.) A. Heller var. p,NA,US32
AGDE2,AGCRD,Agropyron cristatum (L.) Gaertn. ssp. deserto,NA,US32
AGDE2,AGCRD2,Agropyron cristatum (L.) Gaertn. var. deserto,NA,US32
AGDE2,NA,Agropyron desertorum (Fisch. ex Link) Schult.,desert wheatgrass,US32
AGEL,STEL4,Stylopappus elatus Nutt.,NA,US32
AGEL,NA,Agoseris elata (Nutt.) Greene,tall agoseris,US32
AGERA2,NA,Ageratina Spach,snakeroot,US32
AGEX,AGEXP2,Agrostis exarata Trin. var. pacifica Vasey,NA,US32
AGEX,AGME,Agrostis melaleuca (Trin.) Hitchc.,NA,US32
AGEX,AGEXP,Agrostis exarata Trin. var. purpurascens Hult,NA,US32
AGEX,AGAL2,Agrostis alaskana Hultén,NA,US32
AGEX,AGLO2,Agrostis longiligula Hitchc.,NA,US32
AGEX,NA,Agrostis exarata Trin.,spike bentgrass,US32
AGEX,AGAE2,Agrostis aenea Trin.,NA,US32
AGEX,AGEXM,Agrostis exarata Trin. var. minor Hook.,NA,US32
AGEX,AGLOA,Agrostis longiligula Hitchc. var. australis J,NA,US32
AGEX,AGAM2,Agrostis ampla Hitchc.,NA,US32
AGEX,AGMIM,Agrostis microphylla Steud. var. major Vasey,NA,US32
AGEX,AGAS4,Agrostis asperifolia Trin.,NA,US32
AGEX,AGEXM3,Agrostis exarata Trin. ssp. minor (Hook.) C.L,NA,US32
AGEX,AGEXM2,Agrostis exarata Trin. var. monolepis (Torr.),NA,US32
AGFR,AGCRF2,Agropyron cristatum (L.) Gaertn. var. fragile,NA,US32
AGFR,AGFRM,Agropyron fragile (Roth) P. Candargy ssp. mon,NA,US32
AGFR,AGFRS,Agropyron fragile (Roth) P. Candargy ssp. sib,NA,US32
AGFR,AGCRF,Agropyron cristatum (L.) Gaertn. ssp. fragile,NA,US32
AGFR,AGMO6,Agropyron mongolicum Keng,NA,US32
AGFR,NA,Agropyron fragile (Roth) P. Candargy,Siberian wheatgrass,US32
AGFR,AGFRS2,Agropyron fragile (Roth) P. Candargy var. sib,NA,US32
AGFR,AGSI,Agropyron sibiricum (Willd.) P. Beauv.,NA,US32
AGGI2,AGGID,Agrostis gigantea Roth var. dispar (Michx.) P,NA,US32
AGGI2,AGNI,Agrostis nigra With.,NA,US32
AGGI2,NA,Agrostis gigantea Roth,redtop,US32
AGGI2,AGAL3,Agrostis alba auct. non L.,NA,US32
AGGI2,AGSTG,Agrostis stolonifera L. ssp. gigantea (Roth) ,NA,US32
AGGI2,AGSTM,Agrostis stolonifera L. var. major (Gaudin) F,NA,US32
AGGL,NA,Agoseris glauca (Pursh) Raf.,pale agoseris,US32
AGGLA,NA,Agoseris glauca (Pursh) Raf. var. agrestis (O,pale agoseris,US32
AGGLA,AGAG,Agoseris agrestis Osterh.,NA,US32
AGGLG,TRGL7,Troximon glaucum Pursh,NA,US32
AGGLG,AGTU3,Agoseris turbinata Rydb.,NA,US32
AGGLG,NA,Agoseris glauca (Pursh) Raf. var. glauca,pale agoseris,US32
AGGLL,AGPA14,Agoseris parviflora (Nutt.) Greene,NA,US32
AGGLL,TRPA12,Troximon parviflorum Nutt.,NA,US32
AGGLL,NA,Agoseris glauca (Pursh) Raf. var. laciniata (,false agoseris,US32
AGGLL,AGGLP,Agoseris glauca (Pursh) Raf. var. parviflora ,NA,US32
AGGLL,AGAR5,Agoseris arizonica Greene,NA,US32
AGGLL,MAGLL,Macrorhynchus glaucus (Pursh) D.C. Eaton var.,NA,US32
AGGLM,AGMO5,Agoseris monticola Greene,NA,US32
AGGLM,NA,Agoseris glauca (Pursh) Raf. var. monticola (,pale agoseris,US32
AGGR,AGPL3,Agoseris plebeja (Greene) Greene,NA,US32
AGGR,TRGR13,Troximon grandiflorum Nutt.,NA,US32
AGGR,AGLA6,Agoseris laciniata (Nutt.) Greene,NA,US32
AGGR,NA,Agoseris grandiflora (Nutt.) Greene,bigflower agoseris,US32
AGGR,AGGRL,Agoseris grandiflora (Nutt.) Greene var. lept,NA,US32
AGHE2,NA,Agoseris heterophylla (Nutt.) Greene,annual agoseris,US32
AGHE5,EUHE7,Eupatorium herbaceum (A. Gray) Greene,NA,US32
AGHE5,NA,Ageratina herbacea (A. Gray) R.M. King & H. R,fragrant snakeroot,US32
AGHEH,AGHEK,Agoseris heterophylla (Nutt.) Greene var. kym,NA,US32
AGHEH,AGHEN,Agoseris heterophylla (Nutt.) Greene ssp. nor,NA,US32
AGHEH,MAHE4,Macrorhynchus heterophyllus Nutt.,NA,US32
AGHEH,AGHEC3,Agoseris heterophylla (Nutt.) Greene var. cry,NA,US32
AGHEH,NA,Agoseris heterophylla (Nutt.) Greene var. het,annual agoseris,US32
AGHEH,AGHEC2,Agoseris heterophylla (Nutt.) Greene ssp. cal,NA,US32
AGHU,POHU,Podagrostis humilis (Vasey) Björkman,NA,US32
AGHU,AGTH2,Agrostis thurberiana Hitchc.,NA,US32
AGHU,NA,Agrostis humilis Vasey,alpine bentgrass,US32
AGHU,POTH3,Podagrostis thurberiana (Hitchc.) Hultén,NA,US32
AGID,AGCL4,Agrostis clavata auct. non Trin.,NA,US32
AGID,AGBOR,Agrostis borealis Hartm. var. recta (Hartm.) ,NA,US32
AGID,AGFI3,Agrostis filicumis M.E. Jones,NA,US32
AGID,NA,Agrostis idahoensis Nash,Idaho bentgrass,US32
AGOC2,NA,Ageratina occidentalis (Hook.) R.M. King & H.,western snakeroot,US32
AGOC2,EUOC5,Eupatorium occidentale Hook.,NA,US32
AGOR,NA,Agrostis oregonensis Vasey,Oregon bentgrass,US32
AGOSE,NA,Agoseris Raf.,agoseris,US32
AGPA8,AGDI,Agrostis diegoensis Vasey,NA,US32
AGPA8,NA,Agrostis pallens Trin.,seashore bentgrass,US32
AGPA8,AGPAV,Agrostis pallens Trin. var. vaseyi H. St. Joh,NA,US32
AGPA8,AGLE2,Agrostis lepida Hitchc.,NA,US32
AGRE,MARE7,Macrorhynchus retrorsus Benth.,NA,US32
AGRE,NA,Agoseris retrorsa (Benth.) Greene,spearleaf agoseris,US32
AGROP2,NA,Agropyron Gaertn.,wheatgrass,US32
AGROS2,NA,Agrostis L.,bentgrass,US32
AGSC5,AGHYT,"Agrostis hyemalis (Walter) Britton, Sterns & ",NA,US32
AGSC5,AGSCS,Agrostis scabra Willd. var. septentrionalis F,NA,US32
AGSC5,NA,Agrostis scabra Willd.,rough bentgrass,US32
AGSC5,AGSCS4,Agrostis scabra Willd. ssp. septentrionalis (,NA,US32
AGSC5,AGHYS,"Agrostis hyemalis (Walter) Britton, Sterns & ",NA,US32
AGSC5,AGHYG,"Agrostis hyemalis (Walter) Britton, Sterns & ",NA,US32
AGSC5,AGGE2,Agrostis geminata Trin.,NA,US32
AGSC5,AGSCG,Agrostis scabra Willd. var. geminata (Trin.) ,NA,US32
AGST2,AGSTP,Agrostis stolonifera L. var. palustris (Huds.,NA,US32
AGST2,AGPA17,Agrostis palustris Huds.,NA,US32
AGST2,AGALS,Agrostis alba L. var. stolonifera (L.) Sm.,NA,US32
AGST2,AGALP,Agrostis alba L. var. palustris (Huds.) Pers.,NA,US32
AGST2,NA,Agrostis stolonifera L.,creeping bentgrass,US32
AGST2,AGSTC,Agrostis stolonifera L. var. compacta Hartm.,NA,US32
AGST2,AGMA10,Agrostis maritima Lam.,NA,US32
AGUR,NA,Agastache urticifolia (Benth.) Kuntze,nettleleaf giant hyssop,US32
AGURU,NA,Agastache urticifolia (Benth.) Kuntze var. ur,nettleleaf giant hyssop,US32
AGUT,NA,Agave utahensis Engelm.,Utah agave,US32
AGUTE,NA,Agave utahensis Engelm. var. eborispina (Hest,Utah agave,US32
AGUTN,NA,Agave utahensis Engelm. var. nevadensis Engel,Nevada agave,US32
AGUTU,NA,Agave utahensis Engelm. var. utahensis,Utah agave,US32
AGVA,AGRO7,Agrostis rossiae auct. non Vasey,NA,US32
AGVA,NA,Agrostis variabilis Rydb.,mountain bentgrass,US32
AIAL,TOAL4,Toxicodendron altissimum Mill.,NA,US32
AIAL,NA,Ailanthus altissima (Mill.) Swingle,tree of heaven,US32
AIAL,AIGL,Ailanthus glandulosa Desf.,NA,US32
AILAN,NA,Ailanthus Desf.,ailanthus,US32
ALAC4,ALACC,Allium acuminatum Hook. var. cuspidatum Ferna,NA,US32
ALAC4,NA,Allium acuminatum Hook.,tapertip onion,US32
ALAE,NA,Alopecurus aequalis Sobol.,shortawn foxtail,US32
ALAEA,ALAEN,Alopecurus aequalis Sobol. var. natans (Wahle,NA,US32
ALAEA,NA,Alopecurus aequalis Sobol. var. aequalis,shortawn foxtail,US32
ALAEA,ALGEA,Alopecurus geniculatus L. var. aristulatus (M,NA,US32
ALAEA,ALAR5,Alopecurus aristulatus Michx.,NA,US32
ALAL3,NA,Alyssum alyssoides (L.) L.,pale madwort,US32
ALAL3,CLAL10,Clypeola alyssoides L.,NA,US32
ALAL3,ALCA11,Alyssum calycinum L.,NA,US32
ALAN,NA,Allium anceps Kellogg,twinleaf onion,US32
ALAT,NA,Allium atrorubens S. Watson,darkred onion,US32
ALATA,NA,Allium atrorubens S. Watson var. atrorubens,darkred onion,US32
ALATC,ALIN4,Allium inyonis M.E. Jones,NA,US32
ALATC,ALNEC,Allium nevadense S. Watson var. cristatum (S.,NA,US32
ALATC,ALCR13,Allium cristatum S. Watson,NA,US32
ALATC,ALATI2,Allium atrorubens S. Watson ssp. inyoensis (M,NA,US32
ALATC,NA,Allium atrorubens S. Watson var. cristatum (S,darkred onion,US32
ALATC,ALATI3,Allium atrorubens S. Watson var. inyoensis (M,NA,US32
ALBI2,NA,Allium bisceptrum S. Watson,twincrest onion,US32
ALBIB,NA,Allium bisceptrum S. Watson var. bisceptrum,twincrest onion,US32
ALBIP,NA,Allium bisceptrum S. Watson var. palmeri (S. ,aspen onion,US32
ALBIP,ALPA8,Allium palmeri S. Watson,NA,US32
ALBR,ALMI4,Allium minimum M.E. Jones,NA,US32
ALBR,NA,Allium brandegeei S. Watson,Brandegee's onion,US32
ALBR,ALDI8,Allium diehlii (M.E. Jones) M.E. Jones,NA,US32
ALBR,ALTRD,Allium tribracteatum Torr. var. diehlii M.E. ,NA,US32
ALCA2,ALCAB,Allium campanulatum S. Watson var. bidwelliae,NA,US32
ALCA2,ALAU2,Allium austinae M.E. Jones,NA,US32
ALCA2,NA,Allium campanulatum S. Watson,dusky onion,US32
ALCA2,ALBI4,Allium bidwelliae S. Watson,NA,US32
ALCEA,NA,Alcea L.,hollyhock,US32
ALDE,NA,Alyssum desertorum Stapf,desert madwort,US32
ALDED,NA,Alyssum desertorum Stapf var. desertorum,desert madwort,US32
ALDED,ALTU2,Alyssum turkestanicum auct. non Regel & Schma,NA,US32
ALGE,NA,Allium geyeri S. Watson,Geyer's onion,US32
ALGE2,NA,Alopecurus geniculatus L.,water foxtail,US32
ALGEG,NA,Allium geyeri S. Watson var. geyeri,Geyer's onion,US32
ALGEG,ALDI5,Allium dictyotum Greene,NA,US32
ALGEG4,NA,Alopecurus geniculatus L. var. geniculatus,water foxtail,US32
ALGEG4,ALPA9,Alopecurus pallescens Piper,NA,US32
ALGET,ALRY,Allium rydbergii J.F. Macbr.,NA,US32
ALGET,ALAR7,"Allium arenicola Osterh., non Small",NA,US32
ALGET,ALSA5,Allium sabulicola Osterh.,NA,US32
ALGET,ALGEG3,Allium geyeri S. Watson var. graniferum L.F. ,NA,US32
ALGET,ALRU5,Allium rubrum Osterh.,NA,US32
ALGET,NA,Allium geyeri S. Watson var. tenerum M.E. Jon,bulbil onion,US32
ALGET,ALFI6,"Allium fibrosum Rydb., non Regel",NA,US32
ALGET,ALGET2,Allium geyeri S. Watson ssp. tenerum (M.E. Jo,NA,US32
ALGI,NA,Allophyllum gilioides (Benth.) A.D. Grant & V,dense false gilyflower,US32
ALGIG,NA,Allophyllum gilioides (Benth.) A.D. Grant & V,dense false gilyflower,US32
ALGIG,GIGI2,Gilia gilioides (Benth.) Greene,NA,US32
ALGIV,GIVI,Gilia violacea A. Heller,NA,US32
ALGIV,GIGIV2,Gilia gilioides (Benth.) Greene var. violacea,NA,US32
ALGIV,NA,Allophyllum gilioides (Benth.) A.D. Grant & V,dense false gilyflower,US32
ALGIV,ALVI4,Allophyllum violaceum (A. Heller) A.D. Grant ,NA,US32
ALGR,ALGRG3,Alisma gramineum Lej. var. graminifolium (Wah,NA,US32
ALGR,ALLA5,Alisma lanceolatum A. Gray,NA,US32
ALGR,NA,Alisma gramineum Lej.,narrowleaf water plantain,US32
ALGR,ALGRW,Alisma gramineum Lej. var. wahlenbergii auct.,NA,US32
ALGR,ALGE3,Alisma geyeri Torr.,NA,US32
ALGR,ALGRA,Alisma gramineum Lej. var. angustissimum (DC.,NA,US32
ALGR,ALGRG2,Alisma gramineum Lej. var. geyeri (Torr.) Lam,NA,US32
ALHAG,NA,Alhagi Gagnebin,alhagi,US32
ALHE3,GIHE,Gilia heterostyla S. Cochrane & A.G. Day,NA,US32
ALHE3,NA,Aliciella heterostyla (S. Cochrane & A.G. Day,cactus flat gilia,US32
ALHU6,GIHU,Gilia hutchinsifolia Rydb.,NA,US32
ALHU6,GILER,Gilia leptomeria A. Gray ssp. rubella (Brand),NA,US32
ALHU6,NA,Aliciella hutchinsifolia (Rydb.) J.M. Porter,desert pale gilia,US32
ALICI,NA,Aliciella Brand,aliciella,US32
ALIN,NA,Allionia incarnata L.,trailing windmills,US32
ALIN2,NA,Alnus incana (L.) Moench,gray alder,US32
ALIN3,NA,Allophyllum integrifolium (Brand) A.D. Grant ,white false gilyflower,US32
ALINN,NA,Allionia incarnata L. var. nudata (Standl.) M,trailing windmills,US32
ALINT,ALPU5,Alnus ×purpusii Callier,NA,US32
ALINT,NA,Alnus incana (L.) Moench ssp. tenuifolia (Nut,thinleaf alder,US32
ALINT,ALINV,Alnus incana (L.) Moench var. virescens S. Wa,NA,US32
ALINT,ALINO,Alnus incana (L.) Moench var. occidentalis (D,NA,US32
